[
  {
    "schema_version": "release-approval/v0",
    "kind": "approval_granted",
    "subject": {
      "receipt_digest": "sha256:a3a3a3a3a3a3a3a3a3a3a3a3a3a3a3a3a3a3a3a3a3a3a3a3a3a3a3a3a3a3a3a3",
      "receipt_semantic_digest": "sha256:b3b3b3b3b3b3b3b3b3b3b3b3b3b3b3b3b3b3b3b3b3b3b3b3b3b3b3b3b3b3b3b3",
      "bundle_digest": "sha256:c3c3c3c3c3c3c3c3c3c3c3c3c3c3c3c3c3c3c3c3c3c3c3c3c3c3c3c3c3c3c3c3",
      "selection_manifest_digest": "sha256:d3d3d3d3d3d3d3d3d3d3d3d3d3d3d3d3d3d3d3d3d3d3d3d3d3d3d3d3d3d3d3d3",
      "target": "staging"
    },
    "principal": {
      "principal_id": "release-captain-02",
      "issuer": "github-actions-oidc",
      "role_snapshot": "release-approver"
    },
    "occurred_at": "2026-08-23T19:00:00Z",
    "expires_at": "2026-08-24T19:00:00Z",
    "event_id": "sha256:1866d1dcf45d937a86d454869a1e3f01a978855a1c1df5e9e8f3c1a94f83c913"
  },
  {
    "schema_version": "release-approval/v0",
    "kind": "approval_revoked",
    "subject": {
      "receipt_digest": "sha256:a3a3a3a3a3a3a3a3a3a3a3a3a3a3a3a3a3a3a3a3a3a3a3a3a3a3a3a3a3a3a3a3",
      "receipt_semantic_digest": "sha256:b3b3b3b3b3b3b3b3b3b3b3b3b3b3b3b3b3b3b3b3b3b3b3b3b3b3b3b3b3b3b3b3",
      "bundle_digest": "sha256:c3c3c3c3c3c3c3c3c3c3c3c3c3c3c3c3c3c3c3c3c3c3c3c3c3c3c3c3c3c3c3c3",
      "selection_manifest_digest": "sha256:d3d3d3d3d3d3d3d3d3d3d3d3d3d3d3d3d3d3d3d3d3d3d3d3d3d3d3d3d3d3d3d3",
      "target": "staging"
    },
    "principal": {
      "principal_id": "release-captain-02",
      "issuer": "github-actions-oidc",
      "role_snapshot": "release-approver"
    },
    "occurred_at": "2026-08-23T19:30:00Z",
    "revoked_approval_event_id": "sha256:1866d1dcf45d937a86d454869a1e3f01a978855a1c1df5e9e8f3c1a94f83c913",
    "event_id": "sha256:1d2787d0dd82f75e7b0ec7f3abb12d9d5e7410508e582f6a6d2be8aef7de11b3"
  }
]
